{
  "schema_version": "accountant.document.v2",
  "source": {
    "file_name": "20241111_153839.jpg",
    "file_path": "../docs/facturi/20241111_153839.jpg",
    "page_count": 1,
    "page_index": 0,
    "detected_document_count": 2,
    "extracted_document_index": 0,
    "image_quality": {
      "readability": "fair",
      "issues": [
        "partial_occlusion_of_supplier_block",
        "overlapping_documents",
        "right_side_text_cut_off"
      ]
    }
  },
  "extraction": {
    "document_type": "invoice",
    "language": "bg",
    "country": "BG",
    "document": {
      "number": "0656479304",
      "date": "2024-11-11",
      "tax_event_date": "2024-11-11",
      "due_date": "2024-11-11",
      "currency": "BGN",
      "exchange_rate": null,
      "place": null,
      "notes": "ДОГОВОР: 506380566"
    },
    "supplier": {
      "name": "А1 България ЕАД",
      "eik": "131468980",
      "vat_number": "BG131468980",
      "address": "ул. Кукуш 1",
      "city": "София",
      "country": "BG",
      "mol": null
    },
    "customer": {
      "name": "Инко трейд ЕООД",
      "eik": "206802564",
      "vat_number": "BG206802564",
      "address": "гр. Варна, кв. 23-ти Микрорайон ( Китайската стена",
      "city": "Варна",
      "country": "BG",
      "mol": "Мариана Кинчова Петрова"
    },
    "totals": {
      "net": null,
      "vat": null,
      "gross": "1699.98",
      "discount": null,
      "rounding": null,
      "amount_due": "1699.98"
    },
    "vat_breakdown": [],
    "payments": [
      {
        "method": "card",
        "amount": "1699.98",
        "currency": "BGN",
        "iban": null,
        "bic": null,
        "bank_name": null
      }
    ],
    "line_items": [
      {
        "description": "Апарат Sam Gal S24 Ultra 256GB Bla+Mode MAT 40",
        "quantity": "1.000",
        "unit": "бр",
        "unit_price": "1769.99",
        "discount_pct": null,
        "vat_rate": null,
        "net": null,
        "vat": null,
        "gross": "1769.99",
        "includes_vat": true
      },
      {
        "description": "Ваучер за отстъпка от устройство 50лв.",
        "quantity": "1.000",
        "unit": "бр",
        "unit_price": "-50.00",
        "discount_pct": null,
        "vat_rate": null,
        "net": null,
        "vat": null,
        "gross": "-50.00",
        "includes_vat": true
      },
      {
        "description": "Отстъпка 20 лв. за устройство в брой",
        "quantity": "1.000",
        "unit": "бр",
        "unit_price": "-20.00",
        "discount_pct": null,
        "vat_rate": null,
        "net": null,
        "vat": null,
        "gross": "-20.00",
        "includes_vat": true
      }
    ],
    "fiscal": {
      "fiscal_receipt_number": "4323",
      "fiscal_device_number": "A1BG4323",
      "operator": "Nikolov",
      "qr_code": "8CE9DE3343EAA440EA0DC85F4A3080BAE8374E96"
    }
  },
  "validation": {
    "needs_review": true,
    "checks": [
      {
        "code": "supplier_eik_checksum",
        "status": "pass",
        "message": ""
      },
      {
        "code": "customer_eik_checksum",
        "status": "pass",
        "message": ""
      },
      {
        "code": "supplier_vat_format",
        "status": "pass",
        "message": ""
      },
      {
        "code": "customer_vat_format",
        "status": "pass",
        "message": ""
      },
      {
        "code": "iban_mod97",
        "status": "skipped",
        "message": "IBAN is null"
      },
      {
        "code": "bic_format",
        "status": "skipped",
        "message": "BIC is null"
      },
      {
        "code": "currency_iso",
        "status": "pass",
        "message": ""
      },
      {
        "code": "document_type_enum",
        "status": "pass",
        "message": ""
      },
      {
        "code": "date_format",
        "status": "pass",
        "message": ""
      },
      {
        "code": "due_date_after_issue",
        "status": "pass",
        "message": ""
      },
      {
        "code": "totals_match",
        "status": "skipped",
        "message": "net/vat/gross not all populated"
      },
      {
        "code": "vat_breakdown_match",
        "status": "skipped",
        "message": "vat_breakdown is empty"
      },
      {
        "code": "line_items_sum",
        "status": "pass",
        "message": "all populated component sums match totals"
      },
      {
        "code": "line_items_incomplete",
        "status": "warning",
        "message": "line items missing component(s): net, vat"
      },
      {
        "code": "multiple_documents_detected",
        "status": "warning",
        "message": "detected 2 documents; only index 0 extracted."
      },
      {
        "code": "image_quality_issue",
        "status": "warning",
        "message": "issues: partial_occlusion_of_supplier_block, overlapping_documents, right_side_text_cut_off"
      }
    ],
    "errors": [],
    "warnings": [
      "line_items_incomplete",
      "multiple_documents_detected",
      "image_quality_issue"
    ]
  },
  "model_assessment": {
    "confidence": {
      "overall": 0.85,
      "document": 0.93,
      "supplier": 0.9,
      "customer": 0.93,
      "totals": 0.92,
      "line_items": 0.78
    },
    "extraction_warnings": [
      "A second document (fiscal/system receipt from A1 България ЕАД) is visible in the upper right of the image; only the main ФАКТУРА was extracted.",
      "The invoice's supplier block (right side, 'Изпълнител') is partially cut off — supplier EIK on the invoice itself is not fully legible; supplier data taken from the fiscal receipt header.",
      "VAT breakdown is not printed separately on the invoice; net and vat totals could not be extracted — only gross total of 1699.98 BGN is available.",
      "Line items on the invoice lack individual price/quantity/VAT columns — amounts taken from the accompanying fiscal receipt.",
      "Fiscal device number read as A1BG4323 but partially obscured; the number 4323 appears both as operator cash register ID and receipt number.",
      "Exchange rate 1 EUR = 1.95583 лв. is printed on the fiscal receipt but the invoice currency appears to be BGN; exchange rate not applied to invoice."
    ]
  },
  "evidence": {
    "document.number": {
      "text": "Номер:0656479304",
      "confidence": 0.97
    },
    "document.date": {
      "text": "Дата на фактура / 11.11.2024",
      "confidence": 0.95
    },
    "document.due_date": {
      "text": "Срок за плащане: 11/11/2024",
      "confidence": 0.93
    },
    "supplier.name": {
      "text": "А1 България ЕАД",
      "confidence": 0.98
    },
    "supplier.eik": {
      "text": "ЕИК: 131468980",
      "confidence": 0.92
    },
    "supplier.vat_number": {
      "text": "ЗДДС №: BG 131468980",
      "confidence": 0.92
    },
    "supplier.address": {
      "text": "София 1309, ул. Кукуш 1",
      "confidence": 0.9
    },
    "customer.name": {
      "text": "Инко трейд ЕООД",
      "confidence": 0.97
    },
    "customer.eik": {
      "text": "ЕИК: 206802564",
      "confidence": 0.97
    },
    "customer.vat_number": {
      "text": "ИД. № по ДДС BG 206802564",
      "confidence": 0.97
    },
    "customer.mol": {
      "text": "МОЛ: Мариана Кинчова Петрова",
      "confidence": 0.95
    },
    "customer.city": {
      "text": "Град: Варна",
      "confidence": 0.98
    },
    "customer.address": {
      "text": "гр. Варна, кв. 23-ти Микрорайон ( Китайската стена",
      "confidence": 0.9
    },
    "totals.gross": {
      "text": "ОБЩА СУМА ЛВ. 1699,98",
      "confidence": 0.97
    },
    "totals.amount_due": {
      "text": "С КАРТА ЛВ. 1699,98",
      "confidence": 0.97
    },
    "line_items[0].description": {
      "text": "Апарат Sam Gal S24 Ultra 256GB Bla+Mode MAT 40",
      "confidence": 0.88
    },
    "line_items[0].gross": {
      "text": "#1 x 1769.99 1769.99",
      "confidence": 0.93
    },
    "line_items[1].description": {
      "text": "Ваучер за отстъпка от устройство 50лв.",
      "confidence": 0.93
    },
    "line_items[1].gross": {
      "text": "#1 x -50.00 -50.00",
      "confidence": 0.93
    },
    "line_items[2].description": {
      "text": "Отстъпка 20 лв. за устройство в брой",
      "confidence": 0.93
    },
    "line_items[2].gross": {
      "text": "#Отстъпка 20 лв. за устройств #1 x -20.00 -20.00",
      "confidence": 0.92
    },
    "fiscal.operator": {
      "text": "Оператор Nikolov",
      "confidence": 0.95
    },
    "fiscal.fiscal_device_number": {
      "text": "A1BG4323",
      "confidence": 0.88
    },
    "fiscal.qr_code": {
      "text": "8CE9DE3343EAA440EA0DC85F4A3080BAE8374E96",
      "confidence": 0.85
    },
    "payments[0].method": {
      "text": "С КАРТА ЛВ. 1699,98",
      "confidence": 0.97
    }
  },
  "provider": {
    "engine": "anthropic",
    "model": "claude-sonnet-4-6",
    "pipeline": "vision_direct",
    "ocr_used": false,
    "prompt_version": "claude-unified-v2-2026-05-09-csharp",
    "created_at": "2026-05-09T15:20:16Z",
    "duration_ms": 37310,
    "input_tokens": 6753,
    "output_tokens": 2355,
    "cost_estimate_usd": "0.0556"
  }
}
