{
  "schema_version": "accountant.document.v2",
  "source": {
    "file_name": "20251008_133131.jpg",
    "file_path": "../docs/facturi/20251008_133131.jpg",
    "page_count": 1,
    "page_index": 0,
    "detected_document_count": 1,
    "extracted_document_index": 0,
    "image_quality": {
      "readability": "excellent",
      "issues": []
    }
  },
  "extraction": {
    "document_type": "invoice",
    "language": "bg",
    "country": "BG",
    "document": {
      "number": "0000015721",
      "date": "2025-10-08",
      "tax_event_date": "2025-10-08",
      "due_date": null,
      "currency": "BGN",
      "exchange_rate": null,
      "place": null,
      "notes": null
    },
    "supplier": {
      "name": "КОРПАРТС ЕООД",
      "eik": "204644699",
      "vat_number": "BG204644699",
      "address": "ж.к.\"Белите брези\" бл.10",
      "city": "София",
      "country": "BG",
      "mol": "НИКОЛАЙ ГЕОРГИЕВ"
    },
    "customer": {
      "name": "МЕД ТЕК ЛАБ ЕООД",
      "eik": "201556176",
      "vat_number": "BG201556176",
      "address": "ул.Рощок № 9",
      "city": "Варна",
      "country": "BG",
      "mol": "Габриела Петрова"
    },
    "totals": {
      "net": "1541.67",
      "vat": "308.33",
      "gross": "1850.00",
      "discount": null,
      "rounding": null,
      "amount_due": "1850.00"
    },
    "vat_breakdown": [
      {
        "rate": "20.00",
        "net": "1541.67",
        "vat": "308.33",
        "gross": "1850.00",
        "reason": null
      }
    ],
    "payments": [
      {
        "method": "cash",
        "amount": "1850.00",
        "currency": "BGN",
        "iban": "BG32FINV91501017158040",
        "bic": "FINVBGSF",
        "bank_name": "Първа инвестиционна банка"
      }
    ],
    "line_items": [
      {
        "description": "МУФА СЪЕДИНИТЕЛ 4WD С ПОМПА ЕЛ. МОТОР IX35/TUCSON /SANTA FE/SORENTO/SPORTAGE (10-20)",
        "quantity": "1.000",
        "unit": "Компл",
        "unit_price": "1541.667",
        "discount_pct": "0.00",
        "vat_rate": "20.00",
        "net": "1541.67",
        "vat": "308.33",
        "gross": "1850.00",
        "includes_vat": false
      }
    ],
    "fiscal": {
      "fiscal_receipt_number": null,
      "fiscal_device_number": null,
      "operator": null,
      "qr_code": null
    }
  },
  "validation": {
    "needs_review": false,
    "checks": [
      {
        "code": "supplier_eik_checksum",
        "status": "pass",
        "message": ""
      },
      {
        "code": "customer_eik_checksum",
        "status": "pass",
        "message": ""
      },
      {
        "code": "supplier_vat_format",
        "status": "pass",
        "message": ""
      },
      {
        "code": "customer_vat_format",
        "status": "pass",
        "message": ""
      },
      {
        "code": "iban_mod97",
        "status": "pass",
        "message": ""
      },
      {
        "code": "bic_format",
        "status": "pass",
        "message": ""
      },
      {
        "code": "currency_iso",
        "status": "pass",
        "message": ""
      },
      {
        "code": "document_type_enum",
        "status": "pass",
        "message": ""
      },
      {
        "code": "date_format",
        "status": "pass",
        "message": ""
      },
      {
        "code": "due_date_after_issue",
        "status": "skipped",
        "message": "issue or due date missing/malformed"
      },
      {
        "code": "totals_match",
        "status": "pass",
        "message": "1541.67 + 308.33 = 1850.00"
      },
      {
        "code": "vat_breakdown_match",
        "status": "pass",
        "message": ""
      },
      {
        "code": "line_items_sum",
        "status": "pass",
        "message": "all populated component sums match totals"
      }
    ],
    "errors": [],
    "warnings": []
  },
  "model_assessment": {
    "confidence": {
      "overall": 1,
      "document": 1,
      "supplier": 1,
      "customer": 1,
      "totals": 1,
      "line_items": 1
    },
    "extraction_warnings": []
  },
  "evidence": {},
  "provider": {
    "engine": "google",
    "model": "gemini-flash-latest",
    "pipeline": "vision_direct",
    "ocr_used": false,
    "prompt_version": "gemini-unified-v2-2026-05-10-csharp-targeted-fixes",
    "created_at": "2026-05-10T08:30:11Z",
    "duration_ms": 13706,
    "input_tokens": 5180,
    "output_tokens": 1002,
    "cost_estimate_usd": "0.0056"
  }
}
