{
  "schema_version": "accountant.document.v2",
  "source": {
    "file_name": "20250730_151449.jpg",
    "file_path": "../docs/facturi/20250730_151449.jpg",
    "page_count": 1,
    "page_index": 0,
    "detected_document_count": 2,
    "extracted_document_index": 0,
    "image_quality": {
      "readability": "excellent",
      "issues": []
    }
  },
  "extraction": {
    "document_type": "invoice",
    "language": "bg",
    "country": "BG",
    "document": {
      "number": "0002677991",
      "date": "2025-07-30",
      "tax_event_date": "2025-07-30",
      "due_date": null,
      "currency": "BGN",
      "exchange_rate": "1.95583",
      "place": null,
      "notes": "Счетоводна статия номер: 14286696"
    },
    "supplier": {
      "name": "Ташев - Галвинг ООД",
      "eik": "130358417",
      "vat_number": "BG130358417",
      "address": "бул. Климент Охридски 68",
      "city": "София",
      "country": "BG",
      "mol": "Христофор Ташев"
    },
    "customer": {
      "name": "Инко Трейд ЕООД",
      "eik": "206802564",
      "vat_number": "BG206802564",
      "address": "ул. Рощок 9",
      "city": "Варна",
      "country": "BG",
      "mol": "Мариана Петрова"
    },
    "totals": {
      "net": "72.50",
      "vat": "14.50",
      "gross": "87.00",
      "discount": null,
      "rounding": null,
      "amount_due": "87.00"
    },
    "vat_breakdown": [
      {
        "rate": "20.00",
        "net": "72.50",
        "vat": "14.50",
        "gross": "87.00",
        "reason": null
      }
    ],
    "payments": [
      {
        "method": "card",
        "amount": "87.00",
        "currency": "BGN",
        "iban": "BG33UNCR76301075613440",
        "bic": "UNCRBGSF",
        "bank_name": "Уникредит Булбанк АД"
      }
    ],
    "line_items": [
      {
        "description": "096 RTH 454, Дъска конусна за развалцоване на тръби, ф 4-16 мм",
        "quantity": "1.000",
        "unit": "бр",
        "unit_price": "72.50",
        "discount_pct": null,
        "vat_rate": "20.00",
        "net": "72.50",
        "vat": "14.50",
        "gross": "87.00",
        "includes_vat": false
      }
    ],
    "fiscal": {
      "fiscal_receipt_number": null,
      "fiscal_device_number": null,
      "operator": null,
      "qr_code": null
    }
  },
  "validation": {
    "needs_review": true,
    "checks": [
      {
        "code": "supplier_eik_checksum",
        "status": "pass",
        "message": ""
      },
      {
        "code": "customer_eik_checksum",
        "status": "pass",
        "message": ""
      },
      {
        "code": "supplier_vat_format",
        "status": "pass",
        "message": ""
      },
      {
        "code": "customer_vat_format",
        "status": "pass",
        "message": ""
      },
      {
        "code": "iban_mod97",
        "status": "pass",
        "message": ""
      },
      {
        "code": "bic_format",
        "status": "pass",
        "message": ""
      },
      {
        "code": "currency_iso",
        "status": "pass",
        "message": ""
      },
      {
        "code": "document_type_enum",
        "status": "pass",
        "message": ""
      },
      {
        "code": "date_format",
        "status": "pass",
        "message": ""
      },
      {
        "code": "due_date_after_issue",
        "status": "skipped",
        "message": "issue or due date missing/malformed"
      },
      {
        "code": "totals_match",
        "status": "pass",
        "message": "72.50 + 14.50 = 87.00"
      },
      {
        "code": "vat_breakdown_match",
        "status": "pass",
        "message": ""
      },
      {
        "code": "line_items_sum",
        "status": "pass",
        "message": "all populated component sums match totals"
      },
      {
        "code": "multiple_documents_detected",
        "status": "warning",
        "message": "detected 2 documents; only index 0 extracted."
      }
    ],
    "errors": [],
    "warnings": [
      "multiple_documents_detected"
    ]
  },
  "model_assessment": {
    "confidence": {
      "overall": 1,
      "document": 1,
      "supplier": 1,
      "customer": 1,
      "totals": 1,
      "line_items": 1
    },
    "extraction_warnings": [
      "A fiscal receipt is stapled at the top of the document but is partially obscured and oriented upside down; it was not extracted."
    ]
  },
  "evidence": {},
  "provider": {
    "engine": "google",
    "model": "gemini-flash-latest",
    "pipeline": "vision_direct",
    "ocr_used": false,
    "prompt_version": "gemini-unified-v2-2026-05-09-csharp",
    "created_at": "2026-05-09T15:28:26Z",
    "duration_ms": 13315,
    "input_tokens": 4455,
    "output_tokens": 1012,
    "cost_estimate_usd": "0.0006"
  }
}
